"","index","date","source.domain","originaltext"
"1",98474,2021-11-21,"foxnews.com","chicago mayor needs to dump police boss if <U+0091>crime pandemic<U+0092> isn<U+0092>t addressed, critic says in chicago on friday night, as many as a dozen suspects stormed into a store in the city<U+0092>s chatham neighborhood and grabbed as many items as they could carry, according to a report."
"2",23319,2021-07-29,"foxnews.com","randi weingarten ripped after telling msnbc 'we're going to try' to reopen schools after cdc mask guidance american federation of teachers (aft) president randi weingarten was ripped after hedging on whether or not u.s. schools would reopen in the fall during a wednesday interview on msnbc."
"3",144569,2021-04-16,"dailywire.com","pfizer ceo: third covid vaccine dose <U+0091>likely<U+0092> needed within 12 months pfizer ceo albert bourla says people will <U+0093>likely<U+0094> need to take a third dose of a covid-19 vaccine within 12 months of getting fully vaccinated and that many may need annual vaccinations against the virus."
"4",38059,2021-08-26,"abc13.com","texas a&m researchers develop treatment to help fight covid-19 embed >more news videos it's an fda-approved drug for a specific purpose, but one houston doctor says he's been using ivermectin to treat covid-19 patients."
"5",97919,2021-11-28,"silive.com","nyc civil service exam: these applications are open in december staten island, n.y. <U+0097> the new york city department of citywide administrative services (dcas) has released its december application schedule for civil service exams."
"6",131938,2021-03-12,"fox13news.com","american, united airlines cancel 27,000 furloughs after covid-19 relief bill passes two of the biggest u.s. airlines have canceled employee furloughs after the house passed covid-19 relief that will provide much-needed payroll support."
"7",21368,2021-07-23,"huffpost.com","ted cruz<U+0092>s covid-19 <U+0092>guarantee<U+0092> comes back to haunt him exactly 1 year later msnbc<U+0092>s chris hayes on thursday reminded sen. ted cruz (r-texas) of his exactly year-old <U+0093>astoundingly, beautifully wrong<U+0094> prediction that democrats would forget about the covid-19 pandemic if joe biden won the 2020 election."
"8",165309,2021-05-17,"cnn.com","analysis: america tastes new freedoms but confronts new dilemmas as it takes off the mask (cnn) vaccinated americans spent the most normal weekend for more than a year exploring restored freedoms to gather without masks but also dilemmas over personal and collective responsibility sparked by new government health guidance."
"9",25010,2021-07-14,"patriotproject.com","az senate president: audit uncovers different vote tally than maricopa county's official numbers arizona state senate president karen fann said tuesday that the audit of maricopa county<U+0092>s general election ballots has already found a discrepancy."
"10",76043,2021-10-25,"reuters.com","u.s. to outline nov. 8 international travel reopening, vaccination rules washington, oct 25 (reuters) - u.s. president joe biden on monday signed an order imposing new vaccine requirements for most foreign national air travelers and lifting severe travel restrictions on china, india and much of europe effective nov. 8, the white house said."
"11",96529,2021-11-05,"usatoday.com","aaron rodgers confirms he<U+0092>s unvaccinated, has taken ivermectin in first comments after testing positive for covid-19 green bay packers quarterback aaron rodgers made his first public comments friday since testing positive for covid-19, addressing why he told the news media in august that he was ""immunized"" and why he is not vaccinated."
"12",550884,2021-12-03,"reuters.com","omicron marches on as biden prepares u.s. for grim winter summary 40 countries find cases of omicron variant"
"13",33541,2021-08-30,"cnbc.com","krispy kreme doubles its free doughnut incentive for vaccinations so, what's better than one free doughnut? two free doughnuts."
"14",547148,2021-12-29,"businessinsider.com","fauci says that the shortened covid-19 isolation guidelines were designed to 'get people back to jobs' anthony fauci said the cdc reduced its coronavirus isolation guidelines to get people back to work."
"15",11349,2021-06-05,"cnn.com","a passenger tried to breach the cockpit of a delta flight, forcing the plane to make an emergency landing (cnn) a passenger attempted to breach the cockpit of a delta air lines flight from los angeles to nashville on friday, forcing the plane to make an emergency stop in albuquerque, new mexico, according to officials."
"16",105033,2021-02-05,"tampabay.com","judge denies publix<U+0092>s request to dismiss covid-19 wrongful death case a judge in miami-dade county denied publix<U+0092>s request to toss out a wrongful death lawsuit that accuses the grocer of carelessly handling employee safety during the early stages of the pandemic."
"17",107561,2021-02-16,"usatoday.com","president biden extends mortgage relief, ban on home foreclosures through june washington <U+0096> president joe biden on tuesday extended a ban on home foreclosures for federally backed mortgages by three months and expanded a mortgage relief program in a push to stabilize the nation's housing affordability crisis amid the covid-19 pandemic."
"18",60443,2021-09-26,"cleveland.com","new coronavirus cases in ohio drop over last 7 days; hospitalizations level off after steady climb: weekly covid roundup cleveland, ohio <U+0096> after weeks of seeing daily and weekly coronavirus case numbers rise to levels not seen since the winter surge, it appears ohio<U+0092>s cases are beginning to dip."
"19",188615,2021-01-30,"npr.org","promising covid-19 vaccine news has some itching to travel again promising covid-19 vaccine news has some itching to travel again"
"20",66550,2021-09-08,"newsbusters.org","crass cnn delighted by kid who flipped off 'vile' anti-mask parents just as the media were delighted by a liberal bicyclist who flipped off president trump<U+0092>s motorcade a few years ago, cnn was enthralled this morning by a teenager who showed the same foul hand gesture to anti-mask parents outside her school."
"21",43553,2021-08-30,"ohiocapitaljournal.com","judge orders cinci hospital to treat covid-19 patient with ivermectin, despite cdc warnings - ohio capital journal a butler county judge ruled in favor of a woman last week who sought to force a hospital to administer ivermectin <U+0097> an animal dewormer that federal regulators have warned against using in covid-19 patients <U+0097> to her husband after several weeks in the icu with the disease."
"22",87888,2021-11-11,"aarp.org","should you ask guests to get covid vaccine and test? covid testing is another <U+FEFF>smart precaution <U+FEFF>to consider before your holiday gathering<U+FEFF>, and some hosts are asking guests take a pcr test in the days before arriving or a rapid antigen test on<U+FEFF>-site. annie sisk, 55, of binghamton, new york, is medically vulnerable and lives with her daughter. they<U+0092>ve invited two vaccinated friends over and will ask them to have a negative covid test before attending."
"23",29158,2021-08-29,"kark.com","caleb wallace, anti-mask organizer and co-founder of the san angelo freedom defenders, dies of covid-19 caleb wallace, the co-founder of the san angelo freedom defenders and west texas minutemen state coordinator has died from causes related to covid-19, according to an update on gofundme by his wife, jessica wallace."
"24",58049,2021-09-24,"inforum.com","north dakota baby<U+0092>s nearly fatal fight with covid-19 signals new risk to children | inforum watford city, n.d. <U+0097> the memory plays over and over in gabby glazer<U+0092>s head."
"25",93555,2021-11-12,"thegatewaypundit.com","scientists are attempting to grow covid vaccine-filled spinach, lettuce, edible plants to replace covid injections millions of people who have refused to get an experimental mrna vaccine may soon be forced to consume the gene therapy in their food."
"26",73638,2021-10-12,"doctorswithoutborders.org","south africa protests urge us and eu to move forward on trips waiver for covid-19 vaccines and medical tools the landmark trips waiver proposal was originally put forward by india and south africa one year ago and is now officially backed by 64 sponsoring governments, with more than 100 countries supporting overall. however, despite dozens of statements by supporting governments emphasizing the waiver<U+0092>s urgency and importance, the proposal has been effectively stalled by a small number of opposing governments, including many in the european union<U+0097>primarily belgium, denmark, finland, germany, ireland, the netherlands, and sweden<U+0097>plus norway, switzerland, and the uk."
"27",144621,2021-04-17,"breitbart.com","maher: medical establishment, media, gov't think 'you can't handle the truth' on covid, left ended up believing 'a bunch of crap' on friday<U+0092>s broadcast of hbo<U+0092>s <U+0093>real time,<U+0094> host bill maher stated that the medical establishment, media, and government have taken a <U+0093>you can<U+0092>t handle the truth<U+0094> approach on coronavirus, and <U+0093>have an agenda to spin us,<U+0094> maher also said that liberal media outlets need to answer for <U+0093>how did your audience wind up believing such a bunch of crap about covid?<U+0094>"
"28",2414,2021-06-12,"deadline.com","l.a. county public health covid-19 report: 4 new deaths & 196 new confirmed cases sunday: on sunday, the la county department of public health reported 5 new deaths from covid-19 and 191 new positive cases."
"29",29046,2021-08-13,"kevinmd.com","i am no longer terrified of covid 2k shares share"
"30",182646,2021-01-30,"nypost.com","sonia sotomayor denies bid from ny parents for kids<U+0092> vaccine exemptions a group of new york parents have lost their bid to get their children exempt from school vaccination requirements after supreme court justice sonia sotomayor rejected the effort."
"31",85983,2021-10-02,"al.com","23 anti-vaccine doctors urge alabama governor to make mandates illegal a letter signed by 23 doctors and five legislators urged alabama gov. kay ivey to add anti-vaccine mandate bills to a special session about prisons and included assertions flagged as misinformation by most medical organizations."
"32",136650,2021-03-03,"houstonchronicle.com","these houston restaurants are sticking with masks, reduced capacity when governor abbott suddenly announced tuesday that he would lift the state mask mandate and allow restaurants and bars to open at 100% capacity, my social media timelines erupted with concern rather than celebration."
"33",87669,2021-11-07,"woodtv.com","white house facing onslaught of challenges to coronavirus vaccine rules president joe biden listens during a meeting with business leaders about the debt limit in the south court auditorium on the white house campus, wednesday, oct. 6, 2021, in washington. (ap photo/evan vucci)"
"34",4727,2021-06-29,"businessinsider.com","insiders say bill gates was an office bully and a womanizer, and that his squeaky-clean image was merely good pr bill and melinda gates announced their divorce in may after nearly three decades of marriage."
"35",146368,2021-04-04,"king5.com","uk eyes testing covid-19 passports at mass gatherings the test events will take place later this month and in may and will include soccer<U+0092>s fa cup semi-final and final at london<U+0092>s wembley stadium."
"36",94259,2021-11-29,"nbcdfw.com","see this year's white house holiday decorations honoring frontline workers holiday decorations unveiled monday for joe and jill biden<U+0092>s first white house christmas honor frontline workers who persevered during the covid-19 pandemic."
"37",87749,2021-11-04,"dailywire.com","aaron rodgers tests positive for covid-19; misled nfl world about vaccination status | the daily wire green bay packers quarterback aaron rodgers will miss sunday<U+0092>s game against the kansas city chiefs due to testing positive for covid on wednesday."
"38",49267,2021-08-30,"npr.org","education dept. announces civil rights investigations into 5 states' mask mandate bans education dept. announces civil rights investigations into 5 states' mask mandate bans"
"39",48742,2021-08-15,"nj.com","a wedding guest. a grad<U+0092>s father. what covid breakthrough cases look like in n.j. she was already sick when the email arrived."
"40",181346,2021-01-31,"the-sun.com","#bidenlied trends as americans demand $2,000 stimulus checks <U+0091>promised<U+0092> by joe the hastag bidenlied has been trending as americans demand $2000 stimulus checks they claim he promised during the election."
"41",92530,2021-11-07,"newsmax.com","scott gottlieb: travelers won't bring many covid infections into us travelers entering the country should not ""feed a lot of additional infections"" when the united states lifts its border restrictions monday for fully vaccinated international travelers, former food and drug administration commissioner scott gottlieb said sunday."
"42",24147,2021-07-08,"wkrn.com","lawmakers renew call for immediate audit of gov. lee<U+0092>s federal covid-19 spending nashville, tenn. (wkrn)- tennessee democrats are calling for an audit of all covid-19 relief spending from governor bill lee and his administration."
"43",127154,2021-03-06,"wsvn.com","biden, dems prevail as senate oks $1.9t virus relief bill washington (ap) <U+0097> an exhausted senate narrowly approved a $1.9 trillion covid-19 relief bill saturday as president joe biden and his democratic allies notched a victory they called crucial for hoisting the country out of the pandemic and economic doldrums."
"44",98058,2021-11-14,"thehill.com","desantis set to convene special session to block vaccine mandates florida gov. ron desantis ron desantisprotester handcuffed, booted from desantis news conference on covid-19 overnight health care <U+0097> presented by astrazeneca and friends of cancer research <U+0097> fda opens up boosters to young teens florida surgeon general blasts 'testing psychology' around covid-19 more (r) will convene a special session of the state legislature starting monday to pass bills aimed at blocking covid-19 vaccine mandates."
"45",184885,2021-01-25,"npr.org","life is 'really tough' for refugees trying to settle in pandemic america life is 'really tough' for refugees trying to settle in pandemic america"
"46",554709,2021-12-24,"winknews.com","3rd florida-based ship has outbreak, state cases hit record 3rd florida-based ship has outbreak, state cases hit record"
"47",64532,2021-09-23,"stopworldcontrol.com","the vaccine death report - millions are dying from the injections cures for covid, and why they are hidden from you"
"48",560974,2021-12-17,"cnbc.com","dr. fauci says u.s. faces oncoming omicron surge as it grapples with jump in delta covid cases dr. anthony fauci takes part in a meeting with u.s. president joe biden and vice president kamala harris and other members of the white house covid-19 response team on developments related to the omicron covid-19 variant from the state dining room at the white house in washington, u.s., december 9, 2021."
"49",5035,2021-06-13,"nbcdfw.com","judge tosses houston hospital workers' vaccine requirement challenge a federal judge threw out a lawsuit filed by employees of a houston hospital system over its requirement that all of its staff be vaccinated against covid-19."
"50",72055,2021-09-09,"axios.com","fauci warns covid infections in u.s. are 10x too high to end pandemic americans are now getting infected with covid-19 at 10 times the rate needed to end the pandemic, which will persist until more people get vaccinated, niaid director anthony fauci tells axios."
"51",133103,2021-03-13,"cbsnews.com","covid-19 vaccine's effect on pregnant women and nursing mothers covid-19 vaccine's effect on pregnant women and nursing mothers doctors say pregnant women are at a higher risk of developing complications from covid-19. that has many wondering if the coronavirus vaccine is safe for them and their unborn child. nikki battiste spoke with dr. andrea edlow, a maternal-fetal medicine specialist at massachusetts general hospital, about a promising new analysis of the vaccine's effect on pregnancy."
"52",10471,2021-06-02,"theblaze.com","republicans demand answers from biden administration on taxpayer funding for research at wuhan lab house republicans have begun the first congressional inquiry into the department of health and human services' apparent failure to review research grants of american taxpayer dollars that funded the bat coronavirus research at a lab in wuhan, china."
"53",72374,2021-10-10,"kxan.com","can i refuse the covid-19 vaccine if my employer requires it? charleston, w.va. (wowk) <U+0096> can employers require employees to get vaccinated? the short answer is yes, and if you<U+0092>re someone who refuses, you could be out of a job."
"54",11761,2021-07-16,"fox26houston.com","fda to decide on full approval of pfizer covid-19 vaccine by january the u.s. food and drug administration will decide on full approval of the pfizer-biontech covid-19 vaccine by january 2022."
"55",82486,2021-10-25,"cnbc.com","u.s. to require contact tracing, covid tests when international visitor curbs lift next month a traveler wears a face mask while checking their phone on the arrivals level outside the tom bradley international terminal (tbit) at los angeles international airport (lax) amid increased covid-19 travel restrictions on january 25, 2021 in los angeles, california."
"56",25365,2021-07-27,"theblaze.com","'it's my show!': desperate chris cuomo tries to bait and shame gop rep. byron donalds over vaccines. it doesn't go too well for cnn host. cnn host chris cuomo seemed desperate for headlines while trying to bait republican u.s. rep. byron donalds of florida into a verbal fight monday <U+0097> but the freshman congressman's calm, cool demeanor proved a stark contrast to cuomo's combative tone."
"57",553253,2021-12-17,"reuters.com","southwest ceo tests positive for covid-19 after senate hearing -- airline southwest airlines ceo gary kelly testifies before the senate commerce, science, and transportation committee in the russell senate office building on capitol hill, in washington, u.s., december 15, 2021 chip somodevilla/pool via reuters"
"58",80934,2021-10-16,"rawstory.com","the ivermectin craze is being fueled by medical front groups with ties to right-wing dark money two years ago, ivermectin was an obscure drug consigned only to those who had the rare displeasure of contracting parasites like scabies or river blindness. american doctors wrote a mere 150,000 prescriptions for the drug in 2019 <U+0096> roughly 0.1% of the prescriptions written for lipitor, a widely used atorvastatin designed to lower cholesterol."
"59",181776,2021-01-22,"cdllife.com","'y'all get it done': law & order svu and music icon thanks truckers for their heroics during covid crisis content sponsored by gp transco"
"60",165549,2021-05-14,"apnews.com","the unwitting are the target of covid-19 falsehoods online dr. michelle rockwell, who was targeted by vaccine opponents after she posted about her miscarriage online, looks at her instagram page with her hijacked post marked as fake news during an interview at her home wednesday, april 28, 2021, in jenks, okla. individuals across the country, like rockwell, have found themselves swept into the misinformation maelstrom, their online posts or their very identities hijacked by anti-vaccine activists and others peddling lies about the covid-19 outbreak. (ap photo/sue ogrocki)"
"61",181727,2021-01-01,"thedailybeast.com","federal judge scorches gov. kristi noem over covid response <U+0091>the villages<U+0092> residents lose commission seats over arrests"
"62",551472,2021-12-03,"cnn.com","teachers: how are you coping with threats, school violence, the pandemic and more? (cnn) teachers have long been more than the people who are educating the next generation of students."
"63",57947,2021-09-29,"minnesota.cbslocal.com","minnesota health care workers file lawsuit over vaccine mandates minneapolis (wcco) <U+0097> nearly 200 health care workers are suing their employers and the federal government over imminent vaccine mandates that they claim violate their rights."
"64",23224,2021-07-03,"fox2now.com","missouri hospital ceo: vaccine opponents should <U+0091>shut up<U+0092> in this tuesday, june 22, 2021, file photo, a man receives a covid-19 vaccine at a clinic in springfield, mo. (nathan papes/the springfield news-leader via ap, file)"
"65",561065,2022-01-01,"thegatewaypundit.com","surprise: fda warns that pfizer's experimental covid pills cause life-threatening reactions when used with many common medications pfizer<U+0092>s antiviral oral drug paxlovid that was developed as an early treatment for covid-19 can cause severe or life-threatening effects if it is taken in tandem with other common medications including some anticoagulants, anti-depressants, and cholesterol-lowering drugs that are used widely across the us, according to a warning from the food and drug administration (fda)."
"66",108596,2021-02-07,"usatoday.com","engelbert humperdinck's wife, patricia healey, 85, dies after contracting covid-19 singer engelbert humperdinck is mourning his wife of 56 years, patricia healey, who died thursday at age 85 after contracting covid-19."
"67",42301,2021-08-04,"huffpost.com","nearly 72,000 new covid-19 cases recorded in children in 1 week nearly 72,000 children across the united states were confirmed to have covid-19 in one week last month, according to an analysis from the american academy of pediatrics and the children<U+0092>s hospital association."
"68",47439,2021-08-19,"huffpost.com","parent assaults teacher, rips mask off her face as texas mask mandate debate continues amid an overheated debate about mask mandates in texas schools, one parent assaulted a teacher by tearing a mask off her face, eanes independent school district superintendent tom leonard said in a statement tuesday."
"69",157033,2021-05-13,"mprnews.org","walz set to 'update' minnesota mask mandate after cdc loosens rules minnesota will end its statewide mask-wearing order on friday following new guidance from the centers for disease control and prevention allowing people who are fully vaccinated against covid-19 to stop wearing masks, gov. tim walz said thursday."
"70",12025,2021-07-12,"cbsnews.com","fauci says it is ""inexplicable"" some americans aren't getting vaccinated despite data washington <U+0097> dr. anthony fauci, chief medical adviser to president biden, said sunday it's ""almost inexplicable"" that some americans continue to resist getting vaccinated against covid-19 despite information showing those who have not received their shots are at a higher risk of becoming infected, especially as the delta variant spreads."
"71",18851,2021-07-03,"fox59.com","petition calling for $2,000 a month stimulus nears 2.5 million signatures stephanie bonin, who owns a restaurant in denver with her husband, created the petition to congress more than a year ago. (file/getty)"
"72",51898,2021-08-08,"clarionledger.com","ole miss football players, staff are 100% vaccinated against covid-19 oxford <U+0097> the ole miss football team has reached 100% vaccination against covid-19, a university spokesperson confirmed to the clarion ledger on sunday."
"73",88694,2021-11-10,"theonion.com","singapore to end free covid-19 treatment to those <U+0091>unvaccinated by choice<U+0092> singapore, considered to have one of the world<U+0092>s best healthcare systems, has announced it will no longer cover medical bills for people who are <U+0093>unvaccinated by choice<U+0094> due to their disproportionate strain on resources. what do you think?"
"74",113247,2021-02-27,"slate.com","more than a dozen house republicans skip covid relief vote due to pandemic but speak at cpac there was a time when republican lawmakers made a big stink about new rules that allowed members of he house of representatives to designate a proxy to vote on their behalf amid the covid-19 pandemic. they were so outraged that republican leaders in the house even filed a lawsuit over the issue, claiming it was unconstitutional. but now it seems things have changed and republican lawmakers like the ability to designate a proxy to vote for them, especially if it means they can travel to florida to attend the conservative political action conference. in all, at least 13 house republicans said the pandemic would force them to be absent and designated a proxy to vote on their behalf when they were scheduled to speak at the cpac conference in orlando."
"75",136072,2021-03-19,"apnews.com","cdc changes school guidance, allowing desks to be closer file - in this march 18, 2021, file photo, fifth grader ally cortez works on her computer at west orange elementary school surrounded by a plastic shield in orange, calif. the centers for disease control and prevention relaxed its social distancing guidelines for schools friday, march 19, saying students can now sit 3 feet apart in classrooms. the new guidelines also remove recommendations for plastic shields or other barriers between desks. (ap photo/jae c. hong)"
