"","index","date","source.domain","originaltext"
"754",42232,2021-08-09,"6abc.com","norristown area school district requiring masks for new school year norristown, pennsylvania (wpvi) -- students, teachers, staff and visitors will be required to wear a mask in the norristown area school district as the first set of kindergarteners and some athletes return to campuses on monday.the norristown area school district is in montgomery county, pennsylvania, which is philadelphia's largest suburban county.school district leaders across the county have the choice of deciding what their mask policy will be and are using the rest of the month to finalize plans before the start of school. the montgomery county health department recently adjusted its guidelines to recommend masks for students and teachers in classrooms.that recommendation falls in line with what the cdc is suggesting.norristown area schools superintendent christopher dormer said he made the decision to take it a step further and require masks because he believes it's the best approach, especially with the vaccines not being eligible for younger children.""for students and parents, it probably is a little terrifying to know that layer of protection (the vaccine), if you're under 12, is not even available to you. so to me, having a mask and trying to keep students socially distant to the greatest distance feasible, it was an easy decision to say this was the right thing to do,"" dormer said.roughly 100 kindergarteners in the school district started their ""boot camp"" program monday at musselman learning center, three weeks before the official start of school to get accustomed to coming back to the classroom.""striking that balance is really important to us. again, i'm not going to risk anyone's life to try to force them back into school when we can do things like masks, keeping them separated, and still right now where transmission is, still giving them a mask break at recess time to get out and do those things,"" dormer said.dormer said they're in a large urban district with older buildings where they have to make the most of the space as students return for in-person learning five days a week.dormer said he is working with the montgomery county health department and children's hospital of philadelphia to do rapid covid-19 testing in schools.""we want to have a mechanism, so when we see those very mild, early indicators - coughing, shortness of breath and all those things - we can rapid test a student, staff member and, with good certainty, in 15 minutes, know if it's a covid infection or not,"" dormer said.dormer also said that over the next few weeks, crews will be working to install touchless bathroom fixtures to help reduce spread in heavily used areas."
"755",165700,2021-05-10,"foxnews.com","pets adopted during the pandemic are being returned at record numbers: report pets are not supposed to be fads."
"756",28583,2021-07-07,"thehill.com","greene compares biden vaccination push to nazis rep. marjorie taylor greene (r-ga.) in a tweet on tuesday compared a push by president biden joe bidenovernight energy & environment <U+0097> manchin raises hopes on climate spending missouri state gop lawmaker resigns for florida consulting job joe manchin stood up for west virginia values more to ensure as many americans are vaccinated against the coronavirus as possible to the people who helped adolf hitler rise to power in nazi germany."
"757",43200,2021-08-22,"newyorker.com","have you already had a breakthrough covid infection? for most of the year, provincetown, massachusetts, on the northern tip of cape cod, has around three thousand residents. in summertime, however, it becomes a vacation destination and gay mecca. thousands of visitors typically descend for festivals, concerts, parades, comedy shows, and parties organized around themed weeks. almost all of this has been suspended during the pandemic; in june, provincetown didn<U+0092>t record a single coronavirus case. then, in early july, thousands of gay men arrived for circuit party week. the crowds thrummed with a sense of post-pandemic exuberance. the weather was rainy, and people squeezed into indoor venues <U+0093>to the point you could hardly move,<U+0094> one reveller, from ohio, told the washington post. another, speaking with npr, recalled that it would <U+0093>get so incredibly hot in these clubs that you would just be wet with sweat, so you<U+0092>d have to step outside for a moment just to get a breath of fresh air.<U+0094>"
"758",120566,2021-03-28,"truthout.org","people paid a big price for prematurely dropping pandemic measures a century ago picture the united states struggling to deal with a deadly pandemic."
"759",81937,2021-10-19,"npr.org","moderna won't share its vaccine recipe. who has hired an african startup to crack it moderna won't share its vaccine recipe. who has hired an african startup to crack it"
"760",31572,2021-08-09,"khou.com","hospitals facing nurse shortage as covid-19 hospitalizations continue to climb ""we<U+0092>re working hard. while the city is debating about masks, we<U+0092>re just trying to keep everyone safe when they come through those doors,<U+0094> one houston er nurse said."
"761",67082,2021-09-25,"catholicnewsagency.com","new brunswick dioceses will not require covid vaccination to attend mass proof of vaccination is required at such venues as restaurants and movie theatres, but an accommodation was made for religious venues. some members of the united church of canada, an ecclesial community, have requested that churches not be given an accommodation."
"762",73787,2021-10-08,"iflscience.com","potential universal coronavirus vaccine provides broad protection in mice a vaccine that produces antibodies against the core could protect against all strains of covid-19, the original sars if it came back, and the periodically returning mers. image credit: imageflow/shutterstock.com"
"763",70838,2021-09-17,"freep.com","exhaustion, regret in the halls of hospitals as covid-19 continues to threaten michigan registered nurse anna hollis saw covid-19 vaccines as a lifeline."
"764",170556,2021-01-03,"politico.com","mcconnell, pelosi homes vandalized after $2,000 relief fails kgo-tv reported that graffiti found on the garage door of the democratic leader<U+0092>s home included the phrases <U+0093>$2k,<U+0094> <U+0093>cancel rent!<U+0094> and <U+0093>we want everything,<U+0094> apparently referencing democratic lawmakers<U+0092> failed efforts to increase the coronavirus relief checks from $600 to $2000."
"765",26808,2021-07-21,"washingtonpost.com","in latest clash over wuhan lab, fauci tells sen. rand paul: <U+0091>you do not know what you<U+0092>re talking about<U+0092> the argument, which echoed an earlier dust-up, centered on paul<U+0092>s claim that the national institutes of health awarded a grant that partially funded a project that relied on <U+0093>gain-of-function<U+0094> research, a controversial practice that involves enhancing a virus in a lab to try to anticipate future pandemics. this type of experimentation has come under growing scrutiny as u.s. intelligence agencies investigate the origins of the novel coronavirus and the theory that it could have accidentally leaked from a lab."
"766",60894,2021-09-20,"sportskeeda.com","""police cars have showed up looking for me"" - dan hooker reveals he's not allowed to train at his own empty gym due to new zealand's lockdown rules for the past four weeks, dan hooker has been training at his house because he's not allowed to visit the gym that he owns. the 31-year-old said new zealand's lockdown rules prohibit him from training at his empty gym, which has hindered his fight camp."
"767",98505,2021-11-24,"wallpaper.com","rafael lozano-hemmer<U+0092>s robotic sand installation honours lives lost to covid-19 at the brooklyn museum, rafael lozano-hemmer<U+0092>s participatory work, a crack in the hourglass, an ongoing covid-19 memorial, offers space to collectively honour and grieve victims of the pandemic"
"768",50852,2021-08-01,"nj.com","enough is enough. mandate the vaccine in schools | editorial the delta variant is turbocharging spread among the unvaccinated, and one of the biggest groups in that category is children."
"769",551690,2021-12-11,"newsmax.com","washington gop state senator missing after covid diagnosis a washington state senator critical of democrat gov. jay inslee's vaccine mandates is reportedly missing for weeks after contracting covid-19 during a trip this fall to el salvador."
"770",126407,2021-03-03,"thisiscolossal.com","archaeologists uncover a lavish marble floor from ancient rome in southern france developers of an apartment building in n<ee>mes, france, had to halt construction last month when archaeologists discovered an opulent tiled floor that once blanketed a roman villa, or domu. dating back to 1-2 a.d., the checkered design is comprised of marble from multiple empirical provinces that<U+0092>s inlaid into the foundation, a style called opus sectile that was prevalent during ancient times. spanning multiple feet, the multi-colored pattern is thought to occupy what once was a reception area."
"771",181323,2021-01-21,"dailyboulder.com","george bush sings a sigh of relief after biden takes over presidency associated press reporter meg kinnard reported on wednesday that former president george w. bush was thrilled with president joe biden finally taking over. so much so that he privately thanked house majority whip jim clyburn (d-sc) for his role in the democratic primary that cemented the nomination for biden."
"772",161483,2021-05-08,"nbcnews.com","arizona senate assures feds election recount is secure phoenix <U+0097> the republican president of the arizona senate said in a letter friday to the u.s. justice department that ballots being recounted from november's presidential election are secure and the department's worries about voter intimidation are unfounded."
"773",123128,2021-03-15,"fox13news.com","wife takes nursing home job to still see husband and comply with covid-19 restrictions covid-19 restrictions left cynthia romano with no choice but to take a job at a nursing home in order to see her ailing husband."
"774",95251,2021-11-30,"cnn.com","omicron vs. delta: more mutations don't necessarily make a meaner covid-19 virus (cnn) the new omicron variant of coronavirus, with its many mutations and seemingly quick spread in south africa, is worrying scientists and government officials."
"775",149813,2021-04-29,"nbcnews.com","fda says it won't target black smokers in menthol cigarette ban the food and drug administration<U+0092>s ban on menthol cigarettes will not be enforced against individual consumers, a move that will likely quell concerns about police aggressively targeting black neighborhoods or the possession of illegal cigarettes."
"776",109948,2021-02-01,"nbcnews.com","democrats risk unintended medicare cuts if they pass partisan covid relief washington <U+0097> democrats considering a maneuver to forgo bipartisan support to pass covid-19 relief are confronting an unintended consequence: doing so could automatically cut medicare."
"777",90212,2021-11-08,"minnesota.cbslocal.com","'denied without any questions': health care workers sue northfield hospital over vaccine mandate minneapolis (wcco) <U+0097> some minnesota health care workers are suing over the covid-19 vaccine mandate."
"778",546806,2021-12-30,"thehill.com","fauci calls mental health a 'very important and difficult' part of pandemic white house medical adviser anthony fauci anthony faucimoderna ceo says omicron-specific booster trials will begin soon the hill's 12:30 report: world braces for high-stakes us-russia talks pfizer ceo predicts omicron vaccine will be ready in march more on thursday stressed the importance of mental health as the world prepares to enter the pandemic's third year."
"779",555424,2021-12-08,"reuters.com","senate republican push to block biden's vaccine mandate secures democratic support washington, dec 8 (reuters) - the democratic-controlled u.s. senate on wednesday approved a republican measure that would overturn president joe biden's covid-19 vaccine-or-test mandate for private businesses, with two democrats joining republicans to back the initiative."
"780",56493,2021-09-10,"lawandcrime.com","'no issue of constitutionality': legal experts give biden's 'certainly constitutional' vaccine mandates the go-ahead president joe biden on thursday announced a series of vaccine mandates estimated to impact upwards of 100 million americans."
"781",174631,2021-01-26,"wavy.com","former tides manager ron johnson dies after battle with covid-19 norfolk, va. (wavy) <U+0096> ron johnson, the all-time winningest manager in norfolk tides history, has died of complications from covid-19, the team announced on tuesday."
"782",110449,2021-02-09,"today.com","parents speak out after son's overdose from drugs bought on snapchat dr. laura berman and her husband, samuel chapman, are mourning the loss of their 16-year-old son, sammy, who died of an accidental drug overdose on sunday."
"783",145874,2021-04-27,"oregonlive.com","which portland-area private colleges will require proof of covid-19 vaccination to attend classes this fall? three private colleges in the portland area have announced that they will require students to be vaccinated against covid-19 before school starts in the fall."
"784",27884,2021-07-30,"nypost.com","unvaccinated us swimmer in hot water over maskless interview an unvaccinated swimmer for team usa made waves out of the tokyo olympics<U+0092> pool friday for not wearing a mask during interviews with reporters following a disappointing finish."
"785",165242,2021-05-10,"theblaze.com","teachers union president blames trump and implies vaccine-hesitant fox news viewers are why schools aren't fully reopened the president of the second-largest teachers union in the united states said monday that she supports schools fully reopening for the fall semester but would not commit to doing so."
"786",27604,2021-07-22,"theblaze.com","49 fully vaccinated people in new jersey have died from covid-19 forty-nine fully vaccinated individuals in new jersey have passed away from covid-19 through july 12, garden state health officials informed nj advance media on wednesday."
"787",123357,2021-03-30,"rfangle.com","dr. fauci takes credit for the coronavirus vaccines - the rfangle anthony fauci praised himself for the quick development of the coronavirus vaccine during a cnn coronavirus special sunday night which saw both fauci and dr. birx bashing trump."
"788",50092,2021-08-14,"wbtw.com","sc for ed calls for cities, counties to mandate masks in schools florence, s.c. (wbtw)<U+0096> the teachers group sc for ed is demanding a mask mandate in south carolina schools."
"789",54812,2021-09-24,"npr.org","ny hospitals worry about staff shortages as monday vaccine deadline approaches ny hospitals worry about staff shortages as monday vaccine deadline approaches"
"790",108515,2021-02-24,"abc15.com","fry's electronics is going out of business; cites changing retail market, covid-19 fry<U+0092>s electronics <U+0097> at one time a go-to store for people looking to buy computers, cameras, cords and other electronic and technological accessories <U+0097> is shutting down, according to a statement on its website."
"791",53093,2021-08-07,"fox13news.com","stay in icu for covid patients can cost more than $100k, even with insurance, data shows as more people end up hospitalized for covid-19, they are tacking on costs not just to their well-being but also to their wallets."
"792",82300,2021-10-01,"abcnews.go.com","supreme court justice brett kavanaugh tests positive for covid-19 days before the supreme court is set to resume in-person oral arguments for the first time in 18 months, justice brett kavanaugh has tested positive for covid-19, a court spokeswoman said on friday."
"793",189638,2021-01-12,"nowthisnews.com","lawmakers are testing positive for covid-19 after maskless ""idiocy"" at u.s. capitol riot rep. pramila jayapal (d-wa) looks on during the house judiciary subcommittee on antitrust, commercial and administrative law hearing on online platforms and market power in the rayburn house office building, july 29, 2020 on capitol hill in washington, d.c. | getty images"
"794",81652,2021-10-07,"al.com","pfizer asks fda to approve its covid vaccine for kids ages 5 to 11 pfizer asked the u.s. government thursday to allow use of its covid-19 vaccine in children ages 5 to 11 -- and if regulators agree, shots could begin within a matter of weeks."
"795",102081,2021-02-05,"fox8.com","vp harris casts tie-breaker vote in senate progressing stimulus bill this is an archived article and the information in the article may be outdated. please look at the time stamp on the story to see when it was last updated."
"796",59655,2021-09-30,"apnews.com","ap-norc poll finds deep divide over biden vaccine mandate file - in this sept. 21, 2021, file photo, jackson-hinds comprehensive health center nurse maggie bass, right, injects a covid-19 vaccine into an arm in jackson, miss. a survey of americans on president joe biden<U+0092>s plan to require most workers to get either vaccinated or regularly tested for covid-19 finds a deep and familiar divide: democrats are overwhelmingly for it, while most republicans are against it according to a poll released thursday, sept. 30, by the associated press-norc center for public affairs research. (ap photo/rogelio v. solis, file)"
"797",135812,2021-03-25,"usatoday.com","50m people in the south in the path of severe weather; 'dangerous' tornado outbreak possible latest news friday: more storms forecast this weekend after deadly tornadoes in the south"
"798",122720,2021-03-11,"foxnews.com","cdc could 'soon' ease school distancing guidelines to 3 feet the centers for disease control and prevention (cdc) could ""soon"" ease its coronavirus-related physical distancing guidelines for in-person learning from six-feet to three, researchers tell fox news."
"799",137123,2021-03-02,"fox8.com","mississippi governor also lifts mask mandate, limits on restaurant capacity this is an archived article and the information in the article may be outdated. please look at the time stamp on the story to see when it was last updated."
"800",167727,2021-05-14,"patriotpost.us","cdc grants 'permission' to unmask not that anyone still listens to the much-maligned agency, but it<U+0092>s finally <U+0093>allowing<U+0094> us to ditch the masks."
"801",541526,2021-01-01,"kake.com","second covid-19 vaccine shot may have worse side effects, but don't skip it ""you can think of that second dose as a booster, really, and that's the same vaccine. but that second dose then really boosts the immune system to develop more antibodies to the point that it's 95% effective and protecting that patient,"" said ebersole."
"802",74356,2021-10-10,"townhall.com","dr. fauci on whether people can trick-or-treat for halloween: 'enjoy it' dr. anthony fauci is back to making his regular sunday show appearances. during his october 10 appearance on cnn's ""state of the union,"" fauci told host dana bash that people could enjoy trick-or-treating for halloween later this month. as bash mentioned, it's ""just around the corner."""
"803",549178,2021-12-29,"nypost.com","cdc drastically drops estimate of omicron cases in us the centers for disease control and prevention has drastically reduced its estimate of omicron cases in the us, saying the variant accounted for about 59 percent of covid-19 infections as of christmas day <U+0097> a massive drop from the 73 percent previously reported."
"804",62985,2021-09-07,"detroitnews.com","new covid-19 outbreaks in michigan schools more than triple in one week thirty-one new covid-19 school outbreaks were reported tuesday by state health officials, a more than three-fold increase from last week's numbers."
"805",98170,2021-11-16,"pilotonline.com","norfolk doctor sues sentara over ban on administering ivermectin, other medicines to covid-19 patients the statement went on to say sentara creates treatment guidelines by <U+0093>engaging multi-disciplinary groups of clinicians to review literature, care standards and provide expert advice. in most situations, physicians are able to deviate from guidelines to individualize care for patients. however, in some scenarios, treatments that may potentially harm patients or that are widely considered to be outside the standard of care may be limited.<U+0094>"
"806",171896,2021-01-11,"nbcnewyork.com","gorillas test positive for coronavirus at san diego zoo several gorillas at the san diego zoo safari park have tested positive for the virus that causes covid-19 in what is believed to be the first known case of transmission to apes, san diego zoo global (sdzg) announced on monday."
"807",38258,2021-08-12,"fox6now.com","summerfest covid entry rules frustrate some, refunds wanted concertgoers will need more than a ticket to see a show on the summerfest grounds starting friday, aug. 13. the new covid-19 entry protocols have some customers wanting their money back."
"808",55061,2021-09-10,"theintercept.com","nih documents provide new evidence u.s. funded gain-of-function research in wuhan documents obtained by the intercept contain new evidence that the wuhan institute of virology and the nearby wuhan university center for animal experiment, along with their collaborator, the u.s.-based nonprofit ecohealth alliance, have engaged in what the u.s. government defines as <U+0093>gain-of-function research of concern,<U+0094> intentionally making viruses more pathogenic or transmissible in order to study them, despite stipulations from a u.s. funding agency that the money not be used for that purpose. grant money for the controversial experiment came from the national institutes of health<U+0092>s national institute of allergy and infectious diseases, which is headed by anthony fauci. the award to ecohealth alliance, a research organization which studies the spread of viruses from animals to humans, included subawards to wuhan institute of virology and east china normal university. the principal investigator on the grant is ecohealth alliance president peter daszak, who has been a key voice in the search for covid-19<U+0092>s origins."
"809",547999,2021-12-18,"patch.com","are you complying with ny's mask mandate? [poll] health & fitness are you complying with ny's mask mandate? [poll] the mask mandate will be in effect through jan. 15, at which point it will be revisited. will covid-19 protocol fatigue impact mask usage? replies (260)"
"810",556917,2021-12-14,"cnbc.com","bill gates: <U+0091>conspiracy theories that unfortunately involve me<U+0092> are keeping many americans from the covid vaccines since the start of the pandemic, billionaire health philanthropist bill gates has been a target for bizarre covid conspiracy theories."
"811",115819,2021-02-18,"dailywire.com","trump rips 'mentally gone<U+0092> biden over vaccines, 'won't say yet' if he's running in 2024 former president donald trump blasted president joe biden for his <U+0093>dumb statement<U+0094> during a cnn town hall this week when he claimed no covid-19 vaccine existed before he took office."
"812",48486,2021-08-06,"foxnews.com","texas border mayors sound alarm on covid migrant crisis, declare disaster: we're at a 'breaking point' two texas mayors are sounding the alarm and calling on the biden administration for help as migrants, a significant portion of which have tested positive for covid-19, flood into the lone star state."
"813",558438,2021-12-31,"foxnews.com","liberal journalists shift on coronavirus as omicron variant surges: 'we don't orient our lives around the flu' the final weeks of 2021 and the accompanying surge of covid-19 cases have led to a trend of elite liberal media figures realizing coronavirus is here to stay and life must adjust accordingly."
"814",4591,2021-06-12,"avclub.com","nbc's ultimate slip 'n slide shut down by explosive diarrhea outbreak we don<U+0092>t normally do this, but we<U+0092>d like to begin this particular newswire by setting a few preliminary points, just for the sake of clarity. let<U+0092>s start by acknowledging that diarrhea, while both a funny word, and, platonically, a funny concept, is not actually fun to experience <U+0097>something enhanced in both directions once the word <U+0093>explosive<U+0094> gets involved. let<U+0092>s also remind ourselves of how the last year has put a magnifying glass over potentially unsafe working conditions on entertainment industry sets, and that the creation of workable covid-19 vaccines has not in any way dampened the fact that employers have a duty to the people to employ to ensure that they can do their jobs safely, without any risk of infection or danger."
"815",175077,2021-01-02,"nbcnewyork.com","larry king is hospitalized with coronavirus: reports larry king is battling the coronavirus in a los angeles hospital."
"816",150828,2021-04-02,"theblaze.com","vermont causes controversy by opening early covid vaccine access on explicitly racial lines the state of vermont has caused controversy by announcing that access to the covid-19 vaccine will be opened early along explicitly racial lines, with ""black, indigenous, or a person of color"" residents receiving early access to the vaccine, along with anyone in their family."
"817",2214,2021-06-26,"usatoday.com","sweden set to welcome back american travelers this month, but the cdc advises against it sweden is getting ready to welcome back american tourists."
