"","index","date","source.domain","originaltext"
"1118",560439,2021-12-30,"dailywire.com","<U+0091>this must be the message rolling forward<U+0092>: christian school will return to pre-covid policies | the daily wire an alexandria, virginia k-8 private christian school that is the city<U+0092>s first hybrid-model education program, with students meeting for classroom instruction and tutoring on tuesdays, wednesdays and fridays, and completing schoolwork assignments at home on mondays and thursdays with their families, has taken a strong stand counter to the prevailing practices adopted at public schools across the nation, announcing they are returning to pre-covid health policies."
"1119",85144,2021-10-27,"theonion.com","fda recalls millions of chili peppers, citing fact that if you chop them and touch your junk, your junk will burn washington<U+0097>advising consumers to check their kitchens for contamination as soon as possible, the food and drug administration announced an immediate recall wednesday of millions of u.s.-sold chili peppers after finding evidence that if you chop them and then touch your junk, your junk will burn. <U+0093>due to the serious health threat posed by these peppers, it is vital that you not handle any slices of the affected produce prior to handling your genitalia,<U+0094> said acting fda director janet woodcock, adding that consumers with chili peppers in their homes should not panic, but should make sure they dispose of them properly and without delay to avoid a prolonged sensation in which their vagina or penis feels like they accidentally lit it on fire. <U+0093>this is an urgent matter of public safety: if you cut up a jalape<f1>o, serrano, habanero, or other spicy varietal, and then, for any reason, your hand makes contact with your pubic region, that shit will sting like a motherfucker. our agency has been working quickly to remove these peppers from the market ever since an incident in which we were just trying to make a nice panang curry for dinner and instead wound up doubled over on the floor with an absolutely scorching hot crotch. it sucked so bad.<U+0094> the fda stressed this recall was far more serious than its recent onion recalls, noting that while most people recover from salmonella without treatment, relief from chili pepper exposure can require consumers to dip their junk into a cup of milk or, in the most severe cases, a tub of sour cream."
"1120",98064,2021-11-09,"nytimes.com","u.s. urges court not to block vaccine mandate on employers the fifth circuit panel will now decide whether to lift its decision to block the mandate or make it permanent. but it is unlikely to have the final word."
"1121",561262,2021-12-21,"espn.com","nhl to break early for holidays amid covid spike the nhl will pause its season on wednesday, two days before its planned christmas break, the league announced monday evening."
"1122",114019,2021-02-21,"redstate.com","democrats stuff the covid relief bill full of all kinds of pork - just not for the americans who need it house democrats finally released their long-awaited $1.9 trillion wuhan coronavirus relief bill."
"1123",50520,2021-08-30,"childrenshealthdefense.org","here<U+0092>s why no one can force you to take pfizer<U+0092>s newly <U+0091>approved<U+0092> comirnaty vaccine when the fda announced full approval of pfizer<U+0092>s comirnaty covid vaccine, the media predicted an avalanche of mandates <U+0097> but the fda<U+0092>s own fact sheet for the vaccine states it is <U+0093>your choice to receive or not receive<U+0094> the vaccine."
"1124",559330,2021-12-03,"vox.com","the good and the not as good in biden<U+0092>s winter covid-19 plan evidence-based explanations of the covid-19 pandemic, including how it started, how it might end, and how to protect yourself and others."
"1125",153674,2021-04-07,"metalinjection.net","california venues can reopen at 100% capacity in june california was the first state to implement lockdowns, and it will be one of the first states to fully reopen (following texas, missouri, alabama and west virginia). starting on june 15, businesses can re-open at full capacity."
"1126",188037,2021-01-12,"cnn.com","trump administration reverses course and adopts part of biden vaccine distribution plan washington (cnn) the department of health and human services is expected to announce sweeping changes tuesday in vaccine rollout guidelines in an effort to boost the lagging number of vaccinations in the first month -- effectively adopting the approach proposed by president-elect joe biden's incoming administration."
"1127",64826,2021-09-07,"thehill.com","ivermectin poison control calls triple in washington state the number of calls the washington poison center has received regarding the drug ivermectin has tripled in the past year, the seattle times reported on tuesday."
"1128",156595,2021-05-03,"dailykos.com","'you scrunch-faced fear baboon': john oliver takes on tucker carlson's vaccine disinformation it went a little something like this:"
"1129",92845,2021-11-20,"dailywire.com","exclusive: gov. ron desantis tells ben shapiro that lockdown democrats were <U+0091>out at the pool, drinking a margarita<U+0092> in florida | the daily wire on the next episode of <U+0093>the ben shapiro show sunday special,<U+0094> florida gov. ron desantis (r) discusses why he was treated as a villain by the media throughout the covid-19 pandemic and the hypocrisy of those viewed as heroes during the same time."
"1130",60751,2021-09-01,"nj.com","n.j. recommends optional, weekly covid testing for unvaccinated students new jersey school students who are unvaccinated for the coronavirus should undergo regular weekly testing, gov. phil murphy<U+0092>s administration recommended on wednesday."
"1131",30006,2021-08-18,"wgrz.com","hochul: 'i believe that we'll need mask mandates for children to go back to schools' the lieutenant governor says the new york state department of health currently has the authority to implement mask mandates."
"1132",146163,2021-04-04,"reuters.com","troubling ""eek"" variant found in most tokyo hospital covid cases - nhk medical workers and a participant take part in a mock inoculation exercise as the local municipality prepares for coronavirus disease (covid-19) mass vaccination campaign at a shopping mall in sakura, east of tokyo, japan, march 5, 2021. reuters/issei kato"
"1133",120522,2021-03-08,"nbcnews.com","cdc issues new guidance for fully vaccinated people as part of the cdc<U+0092>s new guidance, those fully vaccinated against covid-19 can visit with unvaccinated people from a single household who are at low risk for severe illness without restrictions.march 8, 2021"
"1134",188648,2021-01-29,"wdsu.com","more new orleans area children getting sick with inflammatory syndrome related to covid-19 more new orleans area children getting sick with inflammatory syndrome related to covid-19"
"1135",95389,2021-11-08,"tennesseeconservativenews.com","federal court temporarily halts biden's private sector vaccine mandate - tennessee conservative photo credit: gage skidmore / cc"
"1136",5440,2021-06-12,"pbs.org","covid-19, climate change, china: biden reaffirms america<U+0092>s global role at the g7 yamiche alcindor:"
"1137",25084,2021-07-15,"cnn.com","indonesia overtakes india as asia's new covid-19 epicenter | cnn jakarta, indonesia (cnn) indonesia reported 54,517 new cases of covid-19 , authorities said wednesday, a single-day national record and dire warning sign for the world's fourth-most populous country."
"1138",20815,2021-07-23,"usatoday.com","florida asks supreme court to block federal coronavirus restrictions for cruise ships florida says it has lost tens of millions of dollars in revenue because of the cruise rules."
"1139",27973,2021-07-14,"hawaiinewsnow.com","hawaii family mourns loss of 3 members after covid quickly spreads through household honolulu (hawaiinewsnow) - in a somber reminder the pandemic isn<U+0092>t over yet, a nanakuli family is mourning the loss of three members after covid-19 quickly spread through their household."
"1140",102327,2021-02-12,"reason.com","cdc's new 'reopening' guidance will keep schools closed in the fall it's an excellent afternoon to be a treasurer for a private school, or an accelerationist seeking to hollow out public support for the government-run education system."
"1141",163947,2021-05-24,"blackenterprise.com","hollie rivers regrets not getting covid-19 vaccine after husband passes away, 'maybe, we should get vaccinated.' a michigan family is devastated after its patriarch passed away from covid-19."
"1142",17838,2021-07-25,"medpagetoday.com","can gargling protect school kids from covid? as the largest mass vaccination campaign in human history progresses, the landscape of immunity against sars-cov-2 within the u.s. is changing. the vaccine strategy that began with focused protection for some and rapidly expanded to protection for all, continues to serve as the crucial step in decoupling covid-19 deaths from infections. approximately 50% of our total population is fully vaccinated, as are 80% of those 65 and older. this ""community immunity"" has largely deescalated the risk to those most likely to experience severe outcomes, while simultaneously placing those who cannot or will not be vaccinated in the spotlight. as adult vaccinations continue to rise, the totality of covid-19 risk is diminished."
"1143",6290,2021-06-16,"rollingstone.com","bob dylan announces streaming concert as first post-pandemic performance bob dylan<U+0092>s first post-pandemic performance will take on july 18th as a paid steaming event called shadow kingdom. the show will be presented through veeps, and tickets are $25. it will be available for 48 hours after the initial airing."
"1144",55019,2021-09-22,"khou.com","'mis-c is no joke' | mother shares story after 2 sons hospitalized with covid complications the houston mother said her 9-year-old son was diagnosed with mis-c in january. two months later, her 11-year-old son was hospitalized with the same symptoms."
"1145",182633,2021-01-27,"mysanantonio.com","rgv teen pleads with abbott to help his mom survive covid-19 update: gov. abbott tweeted wednesday night that he spoke to emilian sosa."
"1146",159954,2021-05-08,"fox5vegas.com","utah bar requiring proof of vaccine to dine in receives angry phone calls ***warning: this item contains profanity that has been blurred/bleeped.*** salt lake city bar plans to allow dine-in for vaccinated people, requirement angering some. (kstu via cnn)"
"1147",76956,2021-10-28,"reuters.com","uk study finds vaccinated people easily transmit delta variant in households people walk past a sign encouraging the public to get their coronavirus disease (covid-19) vaccine doses in manchester, britain, october 25, 2021. reuters/phil noble"
"1148",114428,2021-02-01,"foxnews.com","9 of cuomo's top health officials leave amid covid-19 vaccine rollout disagreements new you can now listen to fox news articles!"
"1149",100784,2021-11-10,"futurism.com","new vaccine kills hiv in monkeys, researchers planning human trial image by getty / futurism treatments"
"1150",45879,2021-08-23,"hawaiinewsnow.com","live: governor holds news conference as number of covid cases, hospitalizations soar honolulu (hawaiinewsnow) - the governor is urging visitors to reschedule upcoming travel to hawaii as the state struggles to respond to a covid surge that<U+0092>s threatening to overwhelm hospitals."
"1151",134691,2021-03-11,"axios.com","4 former presidents unite for covid vaccine ad campaign all living former presidents except donald trump have banded together for two national ad campaigns released thursday that are designed to drive trust in covid-19 vaccines."
"1152",157133,2021-05-16,"theguardian.com","republican covid lies follow foreign strongmen<U+0092>s lead <U+0096> and are deadly for it | robert reich a hospital in uttar pradesh, india<U+0092>s most populous state, is being charged under the country<U+0092>s national security act for sounding the alarm over a lack of oxygen that resulted in covid deaths. the hospital<U+0092>s owner and manager says police have accused him of <U+0093>false scaremongering<U+0094>, after he stated publicly that four patients died on a single day when oxygen ran out."
"1153",180129,2021-01-28,"glennbeck.com","dad explains his viral plea before virginia school board to re-open: 'it's about the children' dad explains his viral plea before virginia school board to re-open: 'it's about the children'"
"1154",99364,2021-11-19,"thehill.com","cdc panel endorses covid-19 vaccine boosters for all adults a key outside advisory group to the centers for disease control and prevention (cdc) has endorsed the use of covid-19 booster shots for all adults, a one-size-fits-all approach designed to simplify eligibility."
"1155",128998,2021-03-11,"scoop.upworthy.com","town throws party to thank its only ups driver for working through the pandemic almost every single day people like chad turns restore our faith in humanity. the ups driver was moved to tears after his town showed their appreciation for him in a special way. the pandemic was a tough time for everyone but chad diligently worked hard through it all. residents of dauphin, pennsylvania noticed that their one and only ups driver, chad turns, went above and beyond to make sure things went smoothly despite the difficult period. if chad turns has a big heart, the residents of the small town have just as much. they all came together to throw a sweet surprise for turns who has been delivering packages for ups to dauphin for over a decade."
"1156",92693,2021-11-19,"dailyherald.com","naperville hospital covid-19 patient in ivermectin lawsuit doing better naperville hospital covid-19 patient in ivermectin lawsuit doing better"
"1157",58277,2021-09-07,"tmz.com","joe rogan says ivermectin prescribed by dr., returns to host podcast joe rogan returned to his hosting gig 8 days after testing positive for covid-19, and addressed his use of the controversial medication, ivermectin, insisting he took a human version of the drug that was prescribed by a doctor."
"1158",166438,2021-05-13,"futurism.com","deadly brain-eating fungus outbreak spreads beyond india earlier this week, health officials in india sounded the alarm that <U+0093>black fungus<U+0094> infections called mucormycosis were popping up among covid-19 patients and survivors <U+0097> especially those with diabetes <U+0097> at alarming rates."
"1159",163575,2021-05-21,"complex.com","trump facing $22.9 million lawsuit for calling covid-19 the <U+0091>china virus<U+0092> the chinese american civil rights coalition has filed a lawsuit against donald trump over his usage of <U+0093>china virus<U+0094> when talking about covid-19."
"1160",164342,2021-05-12,"news.yahoo.com","ron desantis threatens to screw his own state to spite the cdc photo illustration by the daily beast / photos via getty"
"1161",89215,2021-11-03,"politicususa.com","twitter suspends newsmax wh correspondent for vaccine conspiracy 2.4k shares facebook twitter whatsapp pinterest reddit print mail flipboard"
"1162",557581,2021-12-23,"nbcnews.com","rapid covid tests makers rush to meet skyrocketing demand the makers of at-home rapid covid tests are scrambling to meet soaring demand as consumers prepare for holiday gatherings and tests are suddenly in short supply amid another coronavirus surge."
"1163",553250,2021-12-16,"washingtonpost.com","understanding omicron<U+0092>s many mutations beta and gamma share the e484k mutation, which appears to thwart certain neutralizing antibodies by changing the shape of their target. omicron has a different amino acid in that spot, and it has changed other immune system targets as well. so the question is whether, and how well, antibodies will still recognize the enemy. fortunately, at least one type of monoclonal antibody called sotrovimab does not seem fooled by the new variant."
"1164",71336,2021-09-22,"mlive.com","parents sue ottawa county over mask mandate; county attorney calls lawsuit <U+0091>nonsense<U+0092> ottawa county, mi <U+0096> a group of parents has filed a lawsuit against ottawa county officials over its health officer<U+0092>s order that pre-kindergarten to sixth-grade students wear masks to slow the spread of covid-19."
"1165",2334,2021-06-22,"fox5atlanta.com","'fed up' georgia gov. kemp rips atl mayor who blames crime surges on covid reopenings article"
"1166",137836,2021-03-08,"breitbart.com","cdc: fully vaccinated people may now gather without masks the centers for disease control and prevention (cdc) released guidelines monday for fully vaccinated people, allowing indoor gathering without masks."
"1167",27249,2021-07-28,"washingtonpost.com","new cdc mask guidance confuses and frustrates some americans as delta variant surges at stake in the renewed push for masking is whether the country can control the spread of the delta variant, which is driving up infections nationwide and threatening to reverse hard-fought gains against the pandemic. new cases in the united states have risen 63 percent in the past week, spiking in louisiana, mississippi and arkansas, where vaccination rates are low. hospitalizations rose more than 40 percent in the same period, according to tracking by the washington post. the rapidly spreading variant could also jeopardize the u.s. economy<U+0092>s fragile recovery, pushing some companies to reexamine whether to bring workers back into offices this fall."
"1168",8222,2021-06-28,"cnn.com","nude sunbathers running from deer fined for violating sydney lockdown (cnn) <U+0097> two men in australia have been fined $760 each for violating sydney 's latest round of lockdowns after police found them naked and lost in the bush as they apparently fled from a wild animal."
"1169",140994,2021-04-06,"kdrv.com","osha fines grants pass restaurant almost $18,000 for alleged covid-19 violations grants pass, ore. <U+0097> the gold miner restaurant in grants pass faces $17,900 in fines from oregon osha for violations of the state's indoor capacity and mask requirements, according to the agency."
"1170",552267,2021-12-14,"businessinsider.com","nurse who was the first person in the us to get vaccinated says healthcare workers are 'tired' and 'concerned' as the pandemic drags on the first person in the us to receive a covid-19 vaccine said healthcare workers were tired."
"1171",150587,2021-04-25,"trendingviews.co","bill gates warned of new kind of terrorism in 2017, mentioned 'an epidemic, either naturally caused or intentionally caused' javascript is disabled. for a better experience, please enable javascript in your browser before proceeding."
"1172",1843,2021-06-06,"thegatewaypundit.com","it's worse than we thought! fauci and top us doctors caught! they conspired to disqualify hydroxychloroquine as covid treatment -- millions dead as a result the gateway pundit has reported extensively this past year on the effects of hydroxychloroquine in treating the covid-19 virus."
"1173",110076,2021-02-08,"dailywire.com","biden<U+0092>s super bowl moment of silence for covid-19 victims draws smattering of boos before the super bowl, president joe biden and first lady jill biden appeared on the big screens at the stadium to pay tribute to frontline workers battling the covid-19 pandemic."
"1174",183990,2021-01-19,"msnbc.com","dr. kavita patel: covid memorial allows americans to <U+0091>grieve<U+0092> and <U+0091>honor<U+0092> 400,000 lives lost to virus msnbc medical contributor dr. kavita patel talks about the importance of the nationwide covid-19 memorial, and how it honors each of the 400,000 americans who have died of the virus showing that <U+0093>they all matter.<U+0094>jan. 19, 2021"
"1175",107051,2021-02-11,"snopes.com","rfk jr. kicked off instagram for vaccine misinformation instagram on wednesday banned robert f. kennedy jr., son of former presidential candidate robert f. kennedy, for repeatedly posting misinformation about vaccine safety and covid-19. kennedy jr. has amassed a huge following on social media, where he frequently posts debunked or unproven claims about vaccines. he also uses his social media pages to post about large pharmaceutical firms and environmental health concerns. <U+0093>we removed this account for repeatedly sharing debunked claims about the coronavirus or<U+0085>"
"1176",147822,2021-04-15,"dailywire.com","jim jordan slams dr. fauci: '15 days to slow the spread turned into one year of lost liberty' congressman jim jordan (r-oh) on thursday slammed dr. anthony fauci for failing to provide a timeline for life to resume as normal. dr. fauci has said americans need to continue with covid precautions, including mask-wearing, social distancing, and large gatherings."
"1177",140605,2021-04-24,"thegatewaypundit.com","shocking video: security brutally drags young child from store by her hoodie because her mask was 'below her nose' update: this video may have originated from a youtube channel called the philly offensive, which appears to create prank videos."
"1178",174587,2021-01-17,"breitbart.com","delingpole: italian restaurants open in mass protest at lockdown rules thousands of restaurants have opened in italy in defiance of the country<U+0092>s strict chinese coronavirus lockdown regulations. the mass civil disobedience campaign <U+0097> launched under the hashtag #ioapro (#iopen) <U+0097> has seen as many as 50,000 restaurants opening despite evening curfew restrictions."
"1179",69700,2021-09-13,"businessinsider.com","18 leading scientists, including 2 former fda officials, say covid-19 booster shots lack evidence and shouldn't yet be given to the general public eighteen leading experts said ""widespread use"" of covid-19 vaccine boosters isn't backed by evidence."
"1180",174163,2021-01-31,"cbsnews.com","cedric richmond says biden willing to meet with gop senators over covid bill washington <U+0097> white house senior adviser cedric richmond said sunday that president biden is willing to sit down with a group of republican senators who are requesting a meeting with the president to discuss a bipartisan coronavirus emergency relief bill."
"1181",148472,2021-04-08,"westernjournal.com","trump's legacy: operation warp speed leads to hiv vaccine trial with a 97% antibody response rate last year, president donald trump<U+0092>s administration worked alongside pharmaceutical companies to develop multiple covid-19 vaccines in record time. now, the technology from one of those vaccines may be used to create even more medical breakthroughs."
"1182",159251,2021-05-13,"wmur.com","first 12-year-old granite stater gets covid-19 vaccine after registration opens for new age group hide transcript show transcript"
"1183",560002,2021-12-25,"startribune.com","as omicron spreads and cases soar, unvaccinated remain defiant cleveland <U+0097> as a fast-spreading new strain of the coronavirus swarms across the country, hospitals in ohio running low on beds and staff recently took out a full-page newspaper advertisement pleading with unvaccinated americans to finally get the shot. it read, simply, ""help."""
"1184",151930,2021-04-08,"nypost.com","people who got moderna covid vaccine report more side effects than pfizer recipients more people taking moderna<U+0092>s coronavirus vaccine reported side effects than those who got the pfizer shot, according to a recent study."
"1185",42953,2021-08-11,"lex18.com","fayette county parents protest mask mandate at all kentucky schools, child care centers lexington, ky. (lex 18) <U+0097> governor beshear's executive order concerning masks in schools and child care centers struck a nerve with some parents and others who do not think face coverings should be mandated."
"1186",189398,2021-01-26,"people.com","kamala harris and doug emhoff receive their second covid-19 vaccine doses ""it really was painless,"" the vice president said"
"1187",100656,2021-11-25,"washingtonpost.com","opinion | florida<U+0092>s new anti-masking law denies us key tools to protect our schools from future covid surges like many other school districts throughout the country, we have a small but vocal group of citizens who opposed those strategies. things have gotten ugly at times. we recently had to disable public comments on our district<U+0092>s facebook page because of threats and personal attacks from, and even between, local citizens. often the talking points online and during board meetings have spilled over into topics that have become intertwined with anti-mask and anti-vaccine rhetoric nationally, such as critical race theory, to gin up even more controversy and activate more opposition."
"1188",19651,2021-07-29,"theblaze.com","us surgeon general recommends fully vaccinated people wear masks outdoors to protect the unvaccinated u.s. surgeon general vivek murthy is recommending that fully vaccinated individuals wear face masks outdoors to protect the unvaccinated. murthy made the suggestion during an appearance on msnbc, where he said fully vaccinated individuals wearing masks indoors and outdoors was an ""extra step"" of protection to unvaccinated people."
"1189",548812,2021-12-18,"today.com","rockettes cancel rest of season as new york records largest one-day covid-19 tally just one week before christmas, the remainder of new york<U+0092>s iconic radio city rockettes season was called off, as the city and state continue to deal with a surge of new covid-19 cases."
"1190",147433,2021-04-22,"christianheadlines.com","biden files appeal that would force religious doctors, hospitals to perform transgender surgeries despite objections on tuesday, president joe biden filed an appeal that would force religious doctors and hospitals to perform transgender-related procedures and surgeries regardless of objections, the daily wire reports."
