"","index","date","source.domain","originaltext"
"378",551683,2021-12-26,"patch.com","slew of positive covid tests forces cruise ship back to ca san diego, ca <U+0097> a cruise ship was heading back to its port in san diego saturday after mexican authorities would not allow 1,000-plus passengers to disembark amid a slew of positive covid-19 tests."
"379",133579,2021-03-13,"nbcnews.com","blind americans face roadblocks booking online vaccine appointments <U+0093>i couldn't get through the form,<U+0094> he said. by the time he figured it out <U+0093>all the appointments were gone.<U+0094>"
"380",24683,2021-07-30,"usatoday.com","olympic swimmer michael andrew refused to wear his mask, but usopc says he didn't violate rules tokyo <U+0097> even though katie ledecky, caeleb dressel and every other u.s. swimmer has worn a mask while doing interviews with journalists at the tokyo aquatics centre, and tokyo is in a state of emergency due to the pandemic, the u.s. olympic and paralympic committee has decided to allow unvaccinated swimmer michael andrew to not wear a mask."
"381",60684,2021-09-02,"abcnews.go.com","how schools are addressing students' mental health needs due to trauma of covid-19 as students return for a third school year affected by the coronavirus pandemic, trauma and grief support are top of mind among educators addressing the wide-reaching impacts of the crisis."
"382",88068,2021-11-21,"newsmax.com","former fda commissioner: 'fully vaccinated' could need boosters former food and drug administration commissioner scott gottlieb on sunday said he believes the centers for disease control and prevention would consider americans ""fully vaccinated"" after they receive a booster shot, bringing the status of a fully vaccinated person to three doses in some cases."
"383",50821,2021-08-09,"rumble.com","rand paul decimates government covid restrictions he is a politician of liberty!"
"384",155355,2021-05-23,"vivaelbirdos.com","molina<U+0092>s homer secures 2-1 victory for cards over cubs the game was on national television on the regular fox channel, with joe buck on the play-by-play, john smoltz on color, and ken rosenthal contributing. miles mikolas took the mound for the cards for his first major league action since september 22nd, 2019. mikolas started the game by hitting joc pederson on the left foot with an 0-1 curve. kris bryant popped a 1-2 low-and-away curve towards the cardinal dugout in foul territory, where paul goldschmidt caught it leaning over the rail. willson contreras sharply grounded an 89 mph 1-1 low-and-away sinker through the right side for a base hit to move pederson to 2nd. tommy edman was lined up close to the 2nd base bag and the right side was wide open. anthony rizzo grounded a high 0-2 sinker to the right side, where goldschmidt cut the ball off and fired to 2nd for a 3-6 force. pederson advanced to 3rd on the play. with runners at the corners and 2 out, javier baez grounded an up-and-in 1-1 sinker through the hole to left for a base hit to score pederson, move rizzo to 2nd and put the cubs on the board 1-1."
"385",79191,2021-10-19,"fox2now.com","in-n-out burger defies vaccine mandate, gets restaurant shut down file <U+0096> in this june 8, 2010, file photo, in-n-out burger signs fill the skyline in baldwin park, calif. (ap photo/adam lau, file)"
"386",173004,2021-01-28,"waff.com","chick-fil-a manager called in to help drive-thru back up at covid-19 vaccine site mount pleasant, s.c. (wcsc) - what do you do when your covid-19 vaccine drive-thru line is backed up? you seek out the professionals."
"387",168102,2021-05-21,"oregonlive.com","you could win $1 million -- but only if you<U+0092>re vaccinated against covid-19, oregon gov. kate brown says gov. kate brown announced friday lottery prizes ranging from $10,000 to $1 million for oregonians vaccinated against covid-19 -- a strategy meant to address the dramatically decreasing numbers of residents inoculated each day."
"388",558390,2021-12-27,"reuters.com","cdc cuts quarantine time for all americans with covid-19 to 5 days dec 27 (reuters) - u.s. health authorities on monday shortened the recommended isolation time for americans with asymptomatic cases of covid-19 to five days from the previous guidance of 10 days."
"389",52341,2021-08-06,"newsnetwork.mayoclinic.org","mayo clinic q and a: answering questions about delta variant, covid-19 vaccination dear mayo clinic: i am hearing more about the delta variant and am worried about my family's risk of becoming infected with covid-19. my husband and i are vaccinated for covid-19, but some of our extended family members are not. they don't seem concerned about the new variant. can you share more information about it and the importance of being vaccinated for covid-19?"
"390",141692,2021-04-02,"aarp.org","doj warns consumers of covid-19 vaccine survey scam ever since the coronavirus pandemic erupted, authorities have been warning the public that criminals follow the headlines and use the news to exploit the confusion surrounding the crisis by creating new ways to steal and swindle. we've seen scams over personal protective equipment and other products in short supply, frauds focused on covid relief dollars, and phony cures and treatments being sold."
"391",190224,2021-01-01,"technologyreview.com","the pandemic taught us how not to deal with climate change there<U+0092>s a case to be made that 2020, for all the sacrifices it demanded and tragedies it inflicted, could at least mark a turning point on climate change."
"392",36484,2021-08-03,"christiantoday.com","'praise god!': billy graham's grandson leaves hospital after covid battle 'praise god!': billy graham's grandson leaves hospital after covid battle"
"393",158547,2021-05-25,"newsandguts.com","kevin mccarthy condemns marjorie taylor greene for comparing mask use to <U+0093>horrors of the holocaust<U+0094> - news & guts media house minority leader kevin mccarthy is condemning anti-semitic comments rep. marjorie taylor greene made comparing mask mandates to the deaths of six million jewish people in the holocaust. mccarthy did not appear on camera, but released a statement."
"394",82127,2021-10-25,"westernjournal.com","covid policing backfires: university faces lawsuit after acting on false report of covid in a time when so much fear and hysteria revolve around a virus, it<U+0092>s more important than ever to have clear and logical processes behind action."
"395",98829,2021-11-05,"who13.com","iowa files lawsuit against biden administration over vaccine mandate rules des moines, iowa <U+0096> iowa<U+0092>s governor has followed through on a vow to fight the new vaccine mandate rules outlined by the federal government."
"396",84913,2021-10-25,"arstechnica.com","florida<U+0092>s surgeon general refused to wear mask to meet senator with cancer florida's top health official was tossed from a meeting last week after refusing to wear a mask in the presence of a state senator with cancer."
"397",60937,2021-09-03,"policetribune.com","wa denies all religious exemptions to vaccine mandates, hundreds of troopers face termination - the police tribune olympia, wa <U+0096> washington state patrol (wsp) employees who refuse to comply with governor jay inslee<U+0092>s covid-19 vaccination mandate will be fired, according to his office."
"398",40930,2021-08-27,"al.com","the south walked school kids into a covid buzzsaw. update: after this column published, the alabama department of public health launched a public dashboard for covid cases in alabama schools, although the data it uses is still incomplete. the alabama department of public health now reports that more than 5,571 students contracted covid in one week, a 700 percent increase over the same time last year."
"399",124444,2021-03-09,"sciencemag.org","countries now scrambling for covid-19 vaccines may soon have surpluses to donate science 's covid-19 reporting is supported by the heising-simons foundation."
"400",170566,2021-01-28,"god.dailydot.com","republican madison cawthorn lit up for using holocaust poem to sell ""useless"" mask recently-elected representative madison cawthorn of north carolina raised eyebrows with a tweet that feels like something that could only come from the most cynical adult swim show."
"401",64000,2021-09-28,"rumble.com","ny gov violates religious freedoms: <U+0093>there are not legitimate religious exemptions<U+0094> to the vaccine she was just put in as governor and she has already become a tyrant."
"402",53026,2021-08-21,"tampabay.com","florida adds 150,118 coronavirus cases, 1,486 deaths in past week florida officials reported 150,118 coronavirus cases over the seven-day period from aug. 13-19, an average of more than 21,400 infections per day. this marks the first time the state<U+0092>s weekly report has recoded a reduction in cases since june 18, more than two months ago."
"403",67563,2021-09-10,"thegatewaypundit.com","joe biden's plan for forced vaccinations for american workers does not include illegal aliens joe biden announced forced vaccinations for millions of american workers on thursday from his perch in the white house. the new rules apply to american workers but not illegal aliens."
"404",118838,2021-02-11,"news.stlpublicradio.org","missouri governor says head of st. louis pandemic task force is lying to cause fear missouri gov. mike parson blasted the head of the st. louis metropolitan pandemic task force at his weekly press briefing thursday, saying dr. alex garza is <U+0093>cherry-picking<U+0094> vaccine distribution data solely to spread <U+0093>fear and panic.<U+0094>"
"405",139194,2021-04-08,"10news.com","seaworld san diego to reopen thrill rides starting april 12 san diego (kgtv) <U+0097> after closing rides to guests for more than a year, seaworld san diego plans to reopen its roller coasters and thrill rides to the public on monday, april 12."
"406",118049,2021-02-28,"longisland.news12.com","johnson & johnson coronavirus vaccine set to provide millions of more doses to ny seniors receive coronavirus vaccines at jewish community center in lawrence"
"407",65188,2021-09-12,"businessinsider.com","see the very good dogs tasked with sniffing out covid-19 at the miami airport covid-19-detecting dogs were unleashed, figuratively, at the miami international airport this week."
"408",183781,2021-02-01,"clickondetroit.com","michigan restaurants reopen indoor dining today: what to know but restaurants will now be able to reopen indoor dining feb. 1 with restrictions, such as operating at 25% capacity and a 10 p.m. curfew."
"409",185660,2021-01-31,"12news.com","payson mom shares heartbreak of losing daughter to covid-related illness elizabeth english died less than a week after coming home from school not feeling well."
"410",90626,2021-11-18,"cnn.com","germany's covid cases hit record high with merkel warning of 'dramatic' situation berlin (cnn) germany reported its highest single day surge of covid-19 infections as chancellor angela merkel said the ""dramatic"" situation was the result of the fourth wave ""hitting our country with full force."""
"411",27031,2021-07-31,"ntd.com","walt disney, walmart mandates covid-19 vaccine for us employees, alters mask policy the walt disney company and walmart announced a new policy on friday that will require nearly every employee working for the company in the united states to be vaccinated against the ccp virus."
"412",35116,2021-08-03,"apnews.com","pentagon on lockdown after gunshots fired near metro police are looking at a scene and items are seen on the ground near a metrobus outside the pentagon metro area, tuesday, aug. 3, 2021 at the pentagon in washington. a pentagon police officer died after being stabbed tuesday during a burst of violence at a transit station outside the building. that's according to law enforcement officials. the pentagon officer was stabbed and later died, according to officials who were not authorized to discuss the matter and spoke to the associated press on condition of anonymity. (ap photo/andrew harnik)"
"413",20228,2021-07-06,"medicalnewstoday.com","delta plus variant of sars-cov-2: what do we know so far? a novel sars-cov-2 variant, the delta plus variant, has been identified in over 10 countries. health authorities are raising concerns that the variant may have an increased ability to transmit, but they also note that this variant<U+0092>s transmissibility is likely similar to that of the preexisting delta variant."
"414",26215,2021-07-08,"wishtv.com","docs: clerk fatally shot man who stole red bull; state rep calls for laws to secure stores better - wish-tv | indianapolis news | indiana weather | indiana traffic crime watch 8"
"415",2333,2021-06-23,"usatoday.com","on second thought: frontier ditches 'covid recovery' fee frontier airlines has rescinded its new covid recovery fee, a day after it was widely publicized."
"416",55543,2021-09-27,"mlive.com","health officials call for school mask mandate in michigan amidst <U+0091>protest mobs,<U+0092> bullying local health officials are again calling on michigan<U+0092>s leadership to institute a statewide mask mandate for k-12 educational institutions to curb coronavirus transmission and keep students in-person for the 2021-22 academic year."
"417",768,2021-06-02,"theconservativeopinion.com","breaking: fauci<U+0092>s forthcoming book removed from amazon, barnes and noble amid backlash after foia emails release dr. anthony fauci<U+0092>s forthcoming book <U+0093>expect the unexpected<U+0094> has been removed for pre-order from all major online booksellers including amazon and barnes an noble."
"418",111488,2021-02-22,"wesh.com","charlie crist asks doj to investigate desantis<U+0092> pop-up vaccine sites for wealthy florida neighborhoods us representative charlie crist announced sunday he has sent a letter to acting attorney general monty wilkinson, asking that the us department of justice investigate concerns surrounding governor ron desantis<U+0092> decision to establish vaccination sites in wealthy neighborhoods, such as lakewood ranch.a release from crist<U+0092>s office says desantis has established <U+0093>coronavirus vaccine distribution and administration sites to benefit political allies and donors, over the needs of higher-risk communities and existing county waitlists.<U+0094>crist says the governor is prioritizing covid-19 vaccines for <U+0093>republican-leaning communities,<U+0094> causing him to turn <U+0093>his back on communities with higher covid infection and death rates.<U+0094>now, crist is asking that the doj investigates if desantis<U+0092> actions violate federal law, warranting a full federal investigation.<U+0093>time and time again, governor desantis has proven he is not up to the task of leading our state out of this pandemic as he continues to play politics with the health and well-being of vulnerable floridians,<U+0094> said crist. <U+0093>so far, over 30,000 floridians have died and at least 1.8 million more have gotten sick, with minority communities and seniors hit the hardest. instead of prioritizing people most at risk, the governor has chosen <U+0096> during the worst pandemic in a century <U+0096> to help out his friends and donors. that is why i<U+0092>m calling on the department of justice to investigate.<U+0094>earlier this week, desantis announced, in partnership with manatee county commissioner vanessa baugh, to set up a pop-up vaccination site for residents in the 34202 and 34211 zip codes. census data shows the two zip codes have median household incomes 75 to 85% higher than the county average.when asked about the issue, desantis told reporters, <U+0093>we wanted to find communities that had high levels of seniors living there and this obviously has a high concentration.<U+0094>however, data shows neighboring zip codes have more seniors and more virus cases.desantis wasn<U+0092>t the only one under fire. commissioner baugh later issued an apology to county residents after she added herself and four others to a <U+0093>vip<U+0094> list to get the vaccine at the already-exclusive clinic in lakewood ranch.<U+0093>it is true that i sent the email because i wanted to make sure certain people were on the list,<U+0094> baugh said."
"419",25227,2021-07-09,"cnn.com","a missouri couple say they dragged their feet on getting the covid-19 vaccine. then they got sick springfield, missouri (cnn) louie michael and his wife, pattie bunch, were both hospitalized last month with covid-19 in springfield, missouri."
"420",156922,2021-05-18,"babylonbee.com","satan announces masks will still be required in hell satan announces masks will still be required in hell"
"421",163585,2021-05-03,"theepochtimes.com","opinion: children must not be vaccinated for covid-19 children must not be vaccinated for covid-19"
"422",147727,2021-04-15,"dailycaller.com","<U+0091>slipping into hacktastic irrelevancy<U+0092>: dagen mcdowell says no one is waiting for fauci<U+0092>s permission to go out fox business host dagen mcdowell said thursday that no one was waiting around for dr. anthony fauci<U+0092>s permission to leave the house."
"423",24143,2021-07-26,"oregonlive.com","coronavirus in oregon: hospitalizations climb 40% in last week, cases climb 53% state health data shows 3,098 new cases of the coronavirus in oregon since monday, july 19, and 12 covid-19 deaths."
"424",42327,2021-08-03,"thefederalist.com","masks and crt are just the start: it's time to break public schools (watch the video for a monologue on this article and an interview with the executive director of the claremont institute<U+0092>s center for the american way of life, arthur milikh, on breaking the power of public schools.)"
"425",48143,2021-08-30,"theblaze.com","study finds mask mandates have no substantial effect on slowing covid-19 spread with students finally headed back to school for the fall, debate is raging nationwide over whether k-12 children should be required to wear face masks to reduce the spread of covid-19. but a peer-reviewed study suggests that mask use and requirements during the pandemic had no substantial impact on reducing the spread of the virus."
"426",130232,2021-03-17,"foxnews.com","democrats block gop rep's bill requiring negative covid tests for illegal immigrants new you can now listen to fox news articles!"
"427",102097,2021-02-25,"uatrav.com","keeping thep thai alive: owner struggles to keep local restaurant open during covid-19 pandemic gingsumrong (third from the left) enjoys a meal with her two daughters and thep thai employees, including cook sataphon ""sang"" sanders (second from the left)."
"428",116180,2021-02-19,"pennlive.com","pa. gov. tom wolf signs another extension of covid-19 disaster declaration pennsylvania gov. tom wolf signed another renewal of the state<U+0092>s disaster declaration tied to the coronavirus pandemic, even as state lawmakers hope to curtail some of his broad powers in emergencies."
"429",119275,2021-02-03,"factcheck.org","video wrong about fauci, covid-19 - factcheck.org scicheck digest"
"430",154513,2021-05-19,"usatoday.com","have covid vaccine, will travel: these are the countries open to fully vaccinated americans corrections & clarifications: germany<U+0092>s, spain's and italy's entry requirements have been updated."
"431",15326,2021-07-27,"q13fox.com","is washington state on the verge of a mask mandate all over again? with the centers for disease control and prevention (cdc) reversing its recommendations on masks, the question is whether or not washington state will upgrade those recommendations to a mandate?"
"432",115357,2021-02-24,"breitbart.com","biden admin will spend $86m to deliver free masks for <U+0091>racial equity' president joe biden<U+0092>s administration announced wednesday a new program to deliver free masks to americans in communities around the country."
"433",79617,2021-10-18,"theblaze.com","joe rogan says google is 'hiding information' about vaccine-related deaths <U+0097> and he stopped using google as a search engine mega-popular podcaster joe rogan said that google is ""hiding information"" about vaccine-related deaths <U+0097> and that he's ceased using google as a search engine."
"434",109458,2021-02-16,"abc13.com","see what's in democrats' relief plan: 3rd stimulus check, unemployment benefits and more stimulus checks"
"435",133980,2021-03-03,"patriotsgazette.com","joe biden calls ending mask mandate in texas <U+0091>neanderthal thinking<U+0092> <U+0097> patriots gazette biden expressed his love of masks during an oval office meeting with congressional democrats which was designated to discuss curing cancer."
"436",147846,2021-04-10,"foxbusiness.com","youtube pulls florida gov. desantis coronavirus roundtable video youtube has removed a video of a public health roundtable discussion with florida gov. ron desantis that included comments advising against mask-wearing in schools in opposition to centers for disease control and prevention covid-19 guidelines."
"437",27016,2021-07-17,"msnbc.com","how to reach out to the vaccine hesitant and convince them to get the shot denise taylor, clinic operations manager for the delta health center in mound bayou, mississippi, talks about the techniques she has used to convince hundreds of people to get vaccinated against covid, talking with people in person, individually in their own communities.july 17, 2021"
"438",108726,2021-02-18,"theroot.com","chicago mayor spent millions of covid relief money on police payroll damn."
"439",102195,2021-02-22,"boston.cbslocal.com","third stimulus check: will your next relief payment be $1,400? (cbs detroit) <U+0097> a third stimulus check is part of the $1.9 trillion economic relief package signed into law by president biden. aside from the $1,400 payment, the american rescue plan also includes extended unemployment benefits, a bigger child tax credit and billions more dollars to stop the spread of covid-19. these and other programs aim to support millions of americans dealing with financial troubles brought on by the pandemic. they<U+0092>re also designed to support the economy as vaccinations continue."
"440",10422,2021-06-10,"the-sun.com","drug touted by trump as covid treatment 'can increase survival rates by 200%' the drug hydroxychloroquine can increase a covid-19 patient's survival rate by up to 200 percent, according to a fresh study."
"441",119239,2021-02-03,"dailycaller.com","andrew cuomo announces indoor dining can resume despite coronavirus being worse than when he banned it democratic new york gov. andrew cuomo announced friday that indoor dining can resume in new york city on valentine<U+0092>s day, despite nearly every coronavirus metric being worse than it was when he banned indoor dining in the first place."
"442",161975,2021-05-20,"iowapublicradio.org","iowa governor signs law immediately banning school mask requirements this story was updated thursday, may 20 at 1:15 a.m."
"443",158011,2021-05-29,"dailywire.com","matthew mcconaughey supports masking: 'a short-term inconvenience' actor matthew mcconaughey defended universal masking, describing it as a <U+0093>short-term inconvenience for long-term freedom.<U+0094>"
"444",72956,2021-10-18,"medicalnewstoday.com","covid-19: how long will 'natural immunity' last? share on pinterest a new study asks how long natural immunity might last. noam galai/getty images"
"445",560769,2021-12-02,"tmz.com","lebron james free of covid, cleared to play lebron james is officially free of covid -- the nba announced he's logged multiple negative tests the past two days -- and he's now been cleared to play for the lakers again."
"446",79387,2021-10-16,"oregonlive.com","unvaccinated father of 5 dies of covid-19 shortly after his wife a virginia dad who <U+0093>treasured<U+0094> his children was hospitalized the same day his wife died of covid-19."
"447",4075,2021-06-13,"consequence.net","the strokes reopen new york city with concert featuring john mulaney, blood orange, aoc: watch on saturday, the strokes played the first full-capacity indoor concert in new york city since the start of the pandemic. the set served as a fundraiser for nyc progressive mayoral candidate maya wiley, and featured appearances by dev hynes of blood orange, comedian john mulaney, and congressional representative alexandria ocasio-cortez."
"448",80071,2021-10-02,"reuters.com","uk to open up more travel by scrapping hotel quarantine for dozens of countries -telegraph prime minister boris johnson looks on during a visit at leeds general infirmary, in leeds, britain october 2, 2021. christopher furlong/pool via reuters"
"449",65504,2021-09-23,"newsandguts.com","axios: some experts see signs of hope as covid cases fall - news & guts media things are headed in the right direction <U+0097> for now, at least."
"450",125,2021-06-02,"cnbc.com","delta variant first found in india spreads to 62 countries, hot spots form in asia and africa, who says a health worker tends to a coronavirus disease (covid-19) patient supported by a mechanical ventilator and undergoing dialysis at the covid-19 emergency room of the government hospital national kidney and transplant institute in quezon city, which has declared overcapacity amid rising numbers of covid-19 infections in quezon city, metro manila, philippines, april 26, 2021."
"451",14130,2021-07-28,"businessinsider.com","vaccine mandates are coming, and it's about time it's a fair question: if vaccines are so great, why don't government workers have to get them?"
"452",12402,2021-07-30,"kwwl.com","reynolds rejects biden's call for $100 vaccine incentives weather alert"
"453",34640,2021-08-19,"usatoday.com","three us senators test positive for covid-19 breakthrough cases sens. roger wicker (r-miss.), angus king (i-maine) and john hickenlooper (d-co.) tested positive for covid-19."
